<?xml version="1.0" encoding="UTF-8"?>
    
<xs:schema xmlns:xs="http://www.w3.org/2001/XMLSchema"
    xmlns:vc="http://www.w3.org/2007/XMLSchema-versioning" elementFormDefault="qualified"
    vc:minVersion="1.0" vc:maxVersion="1.1">
    
    <xs:element name="book">
        <xs:complexType>
            <xs:sequence>
                <xs:element ref="title"/>
                <xs:element ref="chapter" minOccurs="1" maxOccurs="unbounded"/>
            </xs:sequence>
            <xs:attribute name="id" type="xs:ID" use="optional"/>
        </xs:complexType>
    </xs:element>
    
    <xs:element name="title" type="xs:string"/>
    
    
    <xs:element name="chapter">
        <xs:complexType>
            <xs:sequence>
                <xs:element ref="title"/>
                <xs:element ref="para" minOccurs="1" maxOccurs="unbounded"/>
            </xs:sequence>
            <xs:attribute name="id" type="xs:ID" use="optional"/>
        </xs:complexType>
    </xs:element>
    
    <xs:element name="para" >
        <xs:complexType mixed="true">
            <xs:sequence>
                <xs:element ref="emphasis" minOccurs="0" maxOccurs="unbounded"/>
                <xs:element ref="link" minOccurs="0" maxOccurs="unbounded"/>
            </xs:sequence>
            <xs:attribute name="id" type="xs:ID" use="optional"/>
        </xs:complexType>
    </xs:element>
    
    <xs:element name="emphasis" type="xs:string"/>
    
    <xs:element name="link">
        <xs:complexType mixed="true">
            <xs:attribute name="linkend" type="xs:IDREF" use="required"/>            
        </xs:complexType>
        
    </xs:element>
    
</xs:schema>
